{
  "id": "campi-ifpr",
  "title": "Campi do IFPR",
  "descricao": "Índice de campi e campi avançados do Instituto Federal do Paraná.",
  "tipo_item": "campus",
  "atualizado_em": "2026-05-29",
  "items": [
    {
      "id": "arapongas",
      "nome": "Arapongas",
      "path": "institucional/ifpr/campi/arapongas.json"
    },
    {
      "id": "assis-chateaubriand",
      "nome": "Assis Chateaubriand",
      "path": "institucional/ifpr/campi/assis-chateaubriand.json"
    },
    {
      "id": "astorga",
      "nome": "Astorga",
      "path": "institucional/ifpr/campi/astorga.json"
    },
    {
      "id": "barracao",
      "nome": "Barracão",
      "path": "institucional/ifpr/campi/barracao.json"
    },
    {
      "id": "campo-largo",
      "nome": "Campo Largo",
      "path": "institucional/ifpr/campi/campo-largo.json"
    },
    {
      "id": "capanema",
      "nome": "Capanema",
      "path": "institucional/ifpr/campi/capanema.json"
    },
    {
      "id": "cascavel",
      "nome": "Cascavel",
      "path": "institucional/ifpr/campi/cascavel.json"
    },
    {
      "id": "colombo",
      "nome": "Colombo",
      "path": "institucional/ifpr/campi/colombo.json"
    },
    {
      "id": "coronel-vivida",
      "nome": "Coronel Vivida",
      "path": "institucional/ifpr/campi/coronel-vivida.json"
    },
    {
      "id": "curitiba",
      "nome": "Curitiba",
      "path": "institucional/ifpr/campi/curitiba.json"
    },
    {
      "id": "foz-do-iguacu",
      "nome": "Foz do Iguaçu",
      "path": "institucional/ifpr/campi/foz-do-iguacu.json"
    },
    {
      "id": "goioere",
      "nome": "Goioerê",
      "path": "institucional/ifpr/campi/goioere.json"
    },
    {
      "id": "irati",
      "nome": "Irati",
      "path": "institucional/ifpr/campi/irati.json"
    },
    {
      "id": "ivaipora",
      "nome": "Ivaiporã",
      "path": "institucional/ifpr/campi/ivaipora.json"
    },
    {
      "id": "jacarezinho",
      "nome": "Jacarezinho",
      "path": "institucional/ifpr/campi/jacarezinho.json"
    },
    {
      "id": "jaguariaiva",
      "nome": "Jaguariaíva",
      "path": "institucional/ifpr/campi/jaguariaiva.json"
    },
    {
      "id": "londrina",
      "nome": "Londrina",
      "path": "institucional/ifpr/campi/londrina.json"
    },
    {
      "id": "palmas",
      "nome": "Palmas",
      "path": "institucional/ifpr/campi/palmas.json"
    },
    {
      "id": "paranagua",
      "nome": "Paranaguá",
      "path": "institucional/ifpr/campi/paranagua.json"
    },
    {
      "id": "paranavai",
      "nome": "Paranavaí",
      "path": "institucional/ifpr/campi/paranavai.json"
    },
    {
      "id": "pinhais",
      "nome": "Pinhais",
      "path": "institucional/ifpr/campi/pinhais.json"
    },
    {
      "id": "pitanga",
      "nome": "Pitanga",
      "path": "institucional/ifpr/campi/pitanga.json"
    },
    {
      "id": "ponta-grossa",
      "nome": "Ponta Grossa",
      "path": "institucional/ifpr/campi/ponta-grossa.json"
    },
    {
      "id": "quedas-do-iguacu",
      "nome": "Quedas do Iguaçu",
      "path": "institucional/ifpr/campi/quedas-do-iguacu.json"
    },
    {
      "id": "telemaco-borba",
      "nome": "Telêmaco Borba",
      "path": "institucional/ifpr/campi/telemaco-borba.json"
    },
    {
      "id": "umuarama",
      "nome": "Umuarama",
      "path": "institucional/ifpr/campi/umuarama.json"
    },
    {
      "id": "uniao-da-vitoria",
      "nome": "União da Vitória",
      "path": "institucional/ifpr/campi/uniao-da-vitoria.json"
    }
  ]
}
